{
  "schemaVersion": 1,
  "run": {
    "timestamp": "2026-08-30T03:12:02.490Z",
    "label": "touch-repeat-2",
    "suiteGitSha": "37b7c6e4371e8b5764a84c7cf1cec2c5bba81954"
  },
  "machine": {
    "model": "Mac15,8",
    "chip": "Apple M3 Max",
    "pCores": 12,
    "eCores": 4,
    "ramGB": 48,
    "macosVersion": "26.6.2",
    "powerSource": "AC",
    "thermalPressureStart": "nominal"
  },
  "toolchain": {
    "xcode": "26.6",
    "iosRuntime": "iOS 26.5 (26.5)",
    "deviceType": "iPhone 17 Pro",
    "emulatorVersion": "37.1.11.0",
    "systemImage": "not installed",
    "apiLevel": 0,
    "ndk": "not installed",
    "rnVersion": "n/a (rig not yet built — see T04)",
    "maestro": "1.40.0",
    "node": "v24.2.0"
  },
  "config": {
    "avdTuned": {},
    "avdDefault": {}
  },
  "benchmarks": [
    {
      "group": 4,
      "id": "touch.latency",
      "leg": "b",
      "config": "tuned",
      "unit": "ms",
      "n": 30,
      "warmupsDiscarded": 2,
      "samples": [
        4.960773999802768,
        11.568607999943197,
        11.31756699969992,
        3.928234999999404,
        1.180693999864161,
        6.710862000007182,
        16.048820999916643,
        6.981364000122994,
        12.506947999820113,
        12.31782400002703,
        9.00865799980238,
        7.698243000078946,
        5.282451999839395,
        12.68753599980846,
        7.2515369998291135,
        9.557329999748617,
        11.956830999813974,
        8.835415000095963,
        0.5668329996988177,
        6.5932509996928275,
        13.152501999866217,
        8.494127999991179,
        12.597879000008106,
        4.530046000145376,
        5.682380999904126,
        13.585881999693811,
        6.819798999931663,
        13.812884000129998,
        14.466550999786705,
        16.25238600000739
      ],
      "median": 8.922036499949172,
      "p95": 16.048820999916643,
      "p99": 16.25238600000739,
      "cv": 0.45395819281851507
    },
    {
      "group": 4,
      "id": "touch.latency",
      "leg": "c",
      "config": "tuned",
      "unit": "ms",
      "n": 30,
      "warmupsDiscarded": 2,
      "samples": [
        28.065917000174522,
        16.16820800304413,
        20.77462400496006,
        30.180041000247,
        27.181540995836258,
        15.891415998339653,
        29.252916991710663,
        16.48062500357628,
        24.607124999165535,
        24.67883299291134,
        31.82745799422264,
        20.623874992132187,
        19.067833989858627,
        23.0387080013752,
        28.973373994231224,
        21.221374988555908,
        32.4069169908762,
        18.552625000476837,
        16.849415987730026,
        21.366915985941887,
        19.009457990527153,
        21.368665993213654,
        21.97733299434185,
        24.63654199242592,
        22.44241699576378,
        24.804082989692688,
        27.714457988739014,
        25.580707997083664,
        18.38979199528694,
        23.076124995946884
      ],
      "median": 22.74056249856949,
      "p95": 31.82745799422264,
      "p99": 32.4069169908762,
      "cv": 0.2032561961625522
    }
  ],
  "skipped": [],
  "notes": ""
}
