{
  "schemaVersion": 1,
  "run": {
    "timestamp": "2026-09-03T01:28:22.648Z",
    "label": "e2e-flake50",
    "suiteGitSha": "a1e6d8daaee35f056d43c864d2b2db44624b0421"
  },
  "machine": {
    "model": "Mac15,8",
    "chip": "Apple M3 Max",
    "pCores": 12,
    "eCores": 4,
    "ramGB": 48,
    "macosVersion": "26.6.2",
    "powerSource": "AC",
    "thermalPressureStart": "nominal"
  },
  "toolchain": {
    "xcode": "26.6",
    "iosRuntime": "iOS 26.5 (26.5)",
    "deviceType": "iPhone 17 Pro",
    "emulatorVersion": "37.1.11.0",
    "systemImage": "not installed",
    "apiLevel": 0,
    "ndk": "not installed",
    "rnVersion": "n/a (rig not yet built — see T04)",
    "maestro": "1.40.0",
    "node": "v24.2.0"
  },
  "config": {
    "avdTuned": {},
    "avdDefault": {}
  },
  "benchmarks": [
    {
      "group": 6,
      "id": "boot.cold",
      "leg": "c",
      "config": "tuned",
      "unit": "s",
      "n": 8,
      "warmupsDiscarded": 2,
      "samples": [
        4.154,
        4.587,
        4.49,
        4.611,
        4.656,
        4.663,
        4.287,
        4.631
      ],
      "median": 4.599,
      "p95": 4.663,
      "p99": 4.663,
      "cv": 0.04210149208048395
    },
    {
      "group": 6,
      "id": "boot.warm",
      "leg": "c",
      "config": "tuned",
      "unit": "s",
      "n": 8,
      "warmupsDiscarded": 2,
      "samples": [
        3.959,
        4.712,
        4.589,
        4.665,
        4.667,
        4.564,
        4.577,
        4.576
      ],
      "median": 4.583,
      "p95": 4.712,
      "p99": 4.712,
      "cv": 0.05296632389405784
    },
    {
      "group": 6,
      "id": "install.hello.fresh",
      "leg": "c",
      "config": "tuned",
      "unit": "s",
      "n": 8,
      "warmupsDiscarded": 2,
      "samples": [
        0.223,
        0.238,
        0.248,
        0.257,
        0.257,
        0.229,
        0.255,
        0.254
      ],
      "median": 0.251,
      "p95": 0.257,
      "p99": 0.257,
      "cv": 0.054882041306339266
    },
    {
      "group": 6,
      "id": "install.hello.upgrade",
      "leg": "c",
      "config": "tuned",
      "unit": "s",
      "n": 8,
      "warmupsDiscarded": 2,
      "samples": [
        0.282,
        0.262,
        0.262,
        0.238,
        0.233,
        0.23,
        0.262,
        0.262
      ],
      "median": 0.262,
      "p95": 0.282,
      "p99": 0.282,
      "cv": 0.07159902766344252
    },
    {
      "group": 6,
      "id": "install.rig.fresh",
      "leg": "c",
      "config": "tuned",
      "unit": "s",
      "n": 8,
      "warmupsDiscarded": 2,
      "samples": [
        0.35,
        0.32,
        0.303,
        0.324,
        0.349,
        0.33,
        0.314,
        0.313
      ],
      "median": 0.322,
      "p95": 0.35,
      "p99": 0.35,
      "cv": 0.05194792736045302
    },
    {
      "group": 6,
      "id": "install.rig.upgrade",
      "leg": "c",
      "config": "tuned",
      "unit": "s",
      "n": 8,
      "warmupsDiscarded": 2,
      "samples": [
        0.345,
        0.384,
        0.384,
        0.353,
        0.349,
        0.388,
        0.38,
        0.35
      ],
      "median": 0.3665,
      "p95": 0.388,
      "p99": 0.388,
      "cv": 0.0513385737455992
    },
    {
      "group": 6,
      "id": "transfer.push",
      "leg": "c",
      "config": "tuned",
      "unit": "mb_per_s",
      "n": 8,
      "warmupsDiscarded": 2,
      "samples": [
        717.3601147776184,
        773.9938080495356,
        680.2721088435375,
        716.3323782234958,
        753.0120481927711,
        761.03500761035,
        735.2941176470588,
        706.2146892655368
      ],
      "median": 726.3271162123385,
      "p95": 773.9938080495356,
      "p99": 773.9938080495356,
      "cv": 0.04279468412797433
    },
    {
      "group": 6,
      "id": "refresh.metro",
      "leg": "c",
      "config": "tuned",
      "unit": "ms",
      "n": 18,
      "warmupsDiscarded": 2,
      "samples": [
        240,
        236,
        245,
        259,
        282,
        281,
        292,
        278,
        284,
        259,
        238,
        236,
        236,
        234,
        241,
        232,
        236,
        276
      ],
      "median": 243,
      "p95": 292,
      "p99": 292,
      "cv": 0.08430551083922005
    },
    {
      "group": 6,
      "id": "startup.tti",
      "leg": "c",
      "config": "tuned",
      "unit": "ms",
      "n": 8,
      "warmupsDiscarded": 2,
      "samples": [
        743.89208984375,
        825.216064453125,
        788.697998046875,
        748.62109375,
        804.514892578125,
        738.805908203125,
        738.0380859375,
        806.949951171875
      ],
      "median": 768.6595458984375,
      "p95": 825.216064453125,
      "p99": 825.216064453125,
      "cv": 0.04614515560344757
    },
    {
      "group": 6,
      "id": "e2e.duration",
      "leg": "c",
      "config": "tuned",
      "unit": "s",
      "n": 8,
      "warmupsDiscarded": 2,
      "samples": [
        37.388,
        37.382,
        36.784,
        36.912,
        36.878,
        37.097,
        37.41,
        36.862
      ],
      "median": 37.0045,
      "p95": 37.41,
      "p99": 37.41,
      "cv": 0.0071969703034039986
    },
    {
      "group": 6,
      "id": "e2e.flake_rate",
      "leg": "c",
      "config": "tuned",
      "unit": "s",
      "n": 48,
      "warmupsDiscarded": 2,
      "samples": [
        37.487,
        37.069,
        36.707,
        36.824,
        37.613,
        37.056,
        37.205,
        37.27,
        37.182,
        37.457,
        38.123,
        37.204,
        37.326,
        36.696,
        37.131,
        37.557,
        36.4,
        36.646,
        37.525,
        36.634,
        36.651,
        37.474,
        37.567,
        37.481,
        36.986,
        36.274,
        37.363,
        36.82,
        37.447,
        37.007,
        37.431,
        37.662,
        37.25,
        36.838,
        36.276,
        37.171,
        36.646,
        37.474,
        36.654,
        37.197,
        36.804,
        37.532,
        37.363,
        37.348,
        36.979,
        37.138,
        37.3,
        37.164
      ],
      "median": 37.1895,
      "p95": 37.613,
      "p99": 38.123,
      "cv": 0.010568450817484577
    }
  ],
  "skipped": [],
  "notes": ""
}
