{
  "schemaVersion": 1,
  "run": {
    "timestamp": "2026-08-30T01:29:10.785Z",
    "label": "js-scenes-legb-g2",
    "suiteGitSha": "08a74cea1284056c94b87b0fe5b9e26ffff2a0f5"
  },
  "machine": {
    "model": "Mac15,8",
    "chip": "Apple M3 Max",
    "pCores": 12,
    "eCores": 4,
    "ramGB": 48,
    "macosVersion": "26.6.2",
    "powerSource": "AC",
    "thermalPressureStart": "nominal"
  },
  "toolchain": {
    "xcode": "26.6",
    "iosRuntime": "iOS 26.5 (26.5)",
    "deviceType": "iPhone 17 Pro",
    "emulatorVersion": "37.1.11.0",
    "systemImage": "system-images;android-37.0;google_apis;arm64-v8a",
    "apiLevel": 37,
    "ndk": "ndk;26.1.10909125",
    "rnVersion": "n/a (rig not yet built — see T04)",
    "maestro": "1.40.0",
    "node": "v24.2.0"
  },
  "config": {
    "avdTuned": {},
    "avdDefault": {}
  },
  "benchmarks": [
    {
      "group": 2,
      "id": "hermes.json_parse",
      "leg": "b",
      "config": "tuned",
      "unit": "ms_per_op",
      "n": 30,
      "warmupsDiscarded": 2,
      "samples": [
        32.27837500000169,
        33.97516700000051,
        33.14170899999954,
        30.264665999999124,
        29.24962499999674,
        29.081083000000945,
        29.211707999998907,
        29.010167000000365,
        28.14708299999984,
        29.120084000001953,
        27.166042000000743,
        27.265832999997656,
        29.025125000000116,
        27.922042000001966,
        27.796708000001672,
        30.11175000000003,
        27.45916600000055,
        26.473000000001775,
        28.93658299999879,
        27.85175000000163,
        27.760583999999653,
        29.095707999997103,
        27.124291000000085,
        29.291709000000992,
        28.681249999997817,
        30.277500000000146,
        28.048209000000497,
        28.901124999996682,
        27.433249999998225,
        27.1062090000014
      ],
      "median": 28.918853999997737,
      "p95": 33.14170899999954,
      "p99": 33.97516700000051,
      "cv": 0.060598833065170214
    },
    {
      "group": 2,
      "id": "hermes.collections",
      "leg": "b",
      "config": "tuned",
      "unit": "ms_per_op",
      "n": 30,
      "warmupsDiscarded": 2,
      "samples": [
        27.69362500000352,
        29.49079200000051,
        30.372957999999926,
        27.156040999998368,
        27.945457999998325,
        27.259750000001077,
        28.081874999999854,
        31.531000000002678,
        27.744791999997688,
        27.335084000002098,
        29.908833999998024,
        26.696499999998196,
        29.851291999999376,
        32.65437500000189,
        28.559708999997383,
        27.34700000000157,
        28.781416000001627,
        26.255958000001556,
        28.107790999998542,
        31.79595799999879,
        28.081083000000945,
        27.408583000000363,
        28.745999999999185,
        26.18591700000252,
        28.41637499999706,
        30.208833000000595,
        27.82562500000131,
        26.88737499999843,
        28.501625000000786,
        26.07233400000041
      ],
      "median": 28.0814790000004,
      "p95": 31.79595799999879,
      "p99": 32.65437500000189,
      "cv": 0.05855935234204152
    },
    {
      "group": 2,
      "id": "hermes.strings",
      "leg": "b",
      "config": "tuned",
      "unit": "ms_per_op",
      "n": 30,
      "warmupsDiscarded": 2,
      "samples": [
        10.856165999997756,
        12.268541000001278,
        10.787250000001222,
        11.077457999999751,
        10.9967089999991,
        10.57420799999818,
        11.40704100000221,
        11.143625000000611,
        10.952541999999085,
        11.109334000000672,
        10.718707999996695,
        10.94970900000044,
        10.752124999999069,
        10.926917000000685,
        11.444457999998122,
        10.952457999999751,
        10.950000000000728,
        11.69904200000019,
        10.959083000001556,
        11.216625000000931,
        10.795583999999508,
        10.82274999999936,
        11.113333000001148,
        10.751374999999825,
        10.952290999997786,
        11.172874999996566,
        10.961208999997325,
        11.04175000000032,
        11.022417000000132,
        10.651249999998981
      ],
      "median": 10.95581250000032,
      "p95": 11.69904200000019,
      "p99": 12.268541000001278,
      "cv": 0.030204375025778156
    },
    {
      "group": 2,
      "id": "hermes.worklet",
      "leg": "b",
      "config": "tuned",
      "unit": "ms_per_op",
      "n": 30,
      "warmupsDiscarded": 2,
      "samples": [
        13.20879199999763,
        10.039624999997613,
        10.611125000003085,
        10.715917000001355,
        10.073874999994587,
        10.075041999996756,
        10.696624999996857,
        10.29962499999965,
        10.759540999999444,
        10.208208000003651,
        10.573791999995592,
        10.181292000001122,
        10.721041000004334,
        10.25554099999863,
        9.915249999998196,
        10.227624999999534,
        10.161833999998635,
        10.76837499999965,
        10.538000000000466,
        10.627040999999736,
        10.243415999997524,
        10.0098749999961,
        10.220000000001164,
        10.493666999995185,
        10.167249999998603,
        10.325458999999682,
        10.338082999995095,
        9.896833000006154,
        10.41387499999837,
        10.387333000006038
      ],
      "median": 10.312541999999667,
      "p95": 10.76837499999965,
      "p99": 13.20879199999763,
      "cv": 0.05585998284835974
    }
  ],
  "skipped": [],
  "notes": ""
}
