{
  "schemaVersion": 1,
  "run": {
    "timestamp": "2026-08-29T21:50:03.262Z",
    "label": "t03-lega-check",
    "suiteGitSha": "37f4921d2a187fdf4e59984f9746ef6792fbc7e4"
  },
  "machine": {
    "model": "Mac15,8",
    "chip": "Apple M3 Max",
    "pCores": 12,
    "eCores": 4,
    "ramGB": 48,
    "macosVersion": "26.6.2",
    "powerSource": "AC",
    "thermalPressureStart": "nominal"
  },
  "toolchain": {
    "xcode": "26.6",
    "iosRuntime": "iOS 26.5 (26.5)",
    "deviceType": "iPhone 17 Pro",
    "emulatorVersion": "37.1.11.0",
    "systemImage": "not installed",
    "apiLevel": 0,
    "ndk": "not installed",
    "rnVersion": "n/a (rig not yet built — see T04)",
    "maestro": "1.40.0",
    "node": "v24.2.0"
  },
  "config": {
    "avdTuned": {},
    "avdDefault": {}
  },
  "benchmarks": [
    {
      "group": 1,
      "id": "demo.noop_loop",
      "leg": "a",
      "config": "tuned",
      "unit": "ns_per_op",
      "n": 30,
      "warmupsDiscarded": 2,
      "samples": [
        167,
        208,
        1750,
        167,
        167,
        125,
        167,
        125,
        792,
        125,
        83,
        83,
        83,
        83,
        125,
        83,
        84,
        84,
        125,
        83,
        125,
        83,
        125,
        84,
        83,
        83,
        83,
        83,
        84,
        83
      ],
      "median": 84,
      "p95": 792,
      "p99": 1750,
      "cv": 1.718283309750476
    },
    {
      "group": 1,
      "id": "kernel.sha256",
      "leg": "a",
      "config": "tuned",
      "unit": "ns_per_op",
      "n": 30,
      "warmupsDiscarded": 2,
      "samples": [
        3109097000,
        3109793000,
        3111913000,
        3111025000,
        3123267000,
        3112210000,
        3112286000,
        3112068000,
        3110373000,
        3115162000,
        3109615000,
        3111061000,
        3113736000,
        3109859000,
        3109842000,
        3113526000,
        3116616000,
        3110169000,
        3107172000,
        3112257000,
        3112214000,
        3116771000,
        3120449000,
        3103662000,
        3112569000,
        3114137000,
        3110806000,
        3113650000,
        3109480000,
        3111512000
      ],
      "median": 3111990500,
      "p95": 3120449000,
      "p99": 3123267000,
      "cv": 0.0011951050667014871
    },
    {
      "group": 1,
      "id": "kernel.zlib_deflate",
      "leg": "a",
      "config": "tuned",
      "unit": "ns_per_op",
      "n": 30,
      "warmupsDiscarded": 2,
      "samples": [
        807287000,
        809878000,
        810024000,
        813812500,
        811513000,
        815040500,
        824605500,
        810345500,
        814732500,
        810763000,
        815585000,
        811316500,
        815381500,
        806715000,
        810785500,
        808973500,
        811125000,
        812288500,
        814028000,
        813084000,
        807686000,
        809698500,
        806357000,
        811836500,
        812247000,
        814662500,
        811061500,
        811389000,
        807562000,
        809145500
      ],
      "median": 811220750,
      "p95": 815585000,
      "p99": 824605500,
      "cv": 0.004409334466306888
    },
    {
      "group": 1,
      "id": "kernel.matmul_1024",
      "leg": "a",
      "config": "tuned",
      "unit": "ns_per_op",
      "n": 30,
      "warmupsDiscarded": 2,
      "samples": [
        145887125,
        146023500,
        146642750,
        146293750,
        146342125,
        145731625,
        146019000,
        146764000,
        146566250,
        146761875,
        145596625,
        146111125,
        146700375,
        145450625,
        146468500,
        147048500,
        145797875,
        146199625,
        146686375,
        146357750,
        146583125,
        146051625,
        146586500,
        145717750,
        146241625,
        146669250,
        146519000,
        147069000,
        146232375,
        146799875
      ],
      "median": 146349937.5,
      "p95": 147048500,
      "p99": 147069000,
      "cv": 0.002908125642664111
    },
    {
      "group": 1,
      "id": "kernel.stream_triad",
      "leg": "a",
      "config": "tuned",
      "unit": "ns_per_op",
      "n": 30,
      "warmupsDiscarded": 2,
      "samples": [
        5.326,
        5.338,
        5.31,
        5.334,
        5.356,
        5.304,
        5.331,
        5.334,
        5.324,
        5.327,
        5.342,
        5.321,
        5.337,
        5.312,
        5.389,
        5.434,
        5.388,
        5.381,
        5.38,
        5.4,
        5.386,
        5.403,
        5.381,
        5.382,
        5.398,
        5.385,
        5.403,
        5.402,
        5.394,
        5.388
      ],
      "median": 5.3805,
      "p95": 5.403,
      "p99": 5.434,
      "cv": 0.006650576663233117
    },
    {
      "group": 1,
      "id": "kernel.malloc_churn",
      "leg": "a",
      "config": "tuned",
      "unit": "ns_per_op",
      "n": 30,
      "warmupsDiscarded": 2,
      "samples": [
        1.658,
        1.658,
        1.652,
        1.655,
        1.655,
        1.65,
        1.657,
        1.656,
        1.654,
        1.662,
        1.654,
        1.648,
        1.656,
        1.658,
        1.657,
        1.66,
        1.654,
        1.655,
        1.654,
        1.652,
        1.656,
        1.658,
        1.654,
        1.655,
        1.655,
        1.651,
        1.654,
        1.658,
        1.654,
        1.656
      ],
      "median": 1.655,
      "p95": 1.66,
      "p99": 1.662,
      "cv": 0.0017553197128256485
    },
    {
      "group": 1,
      "id": "kernel.clock_gettime_loop",
      "leg": "a",
      "config": "tuned",
      "unit": "ns_per_op",
      "n": 30,
      "warmupsDiscarded": 2,
      "samples": [
        16.019,
        16.087,
        16.045,
        16.13,
        16.04,
        16.003,
        16.045,
        16.013,
        16.071,
        16.083,
        16.103,
        16.043,
        16.047,
        16.008,
        16.127,
        16.127,
        16.1,
        16.047,
        16.012,
        16.016,
        16.123,
        16.049,
        16.057,
        16.114,
        16.015,
        16.055,
        16.038,
        16.031,
        16.062,
        16.061
      ],
      "median": 16.048000000000002,
      "p95": 16.127,
      "p99": 16.13,
      "cv": 0.0024429213144858786
    },
    {
      "group": 1,
      "id": "kernel.getpid_loop",
      "leg": "a",
      "config": "tuned",
      "unit": "ns_per_op",
      "n": 30,
      "warmupsDiscarded": 2,
      "samples": [
        1.102,
        1.102,
        1.108,
        1.103,
        1.101,
        1.103,
        1.099,
        1.103,
        1.107,
        1.103,
        1.103,
        1.101,
        1.098,
        1.102,
        1.101,
        1.101,
        1.104,
        1.105,
        1.099,
        1.105,
        1.1,
        1.102,
        1.105,
        1.103,
        1.1,
        1.101,
        1.1,
        1.102,
        1.104,
        1.1
      ],
      "median": 1.102,
      "p95": 1.107,
      "p99": 1.108,
      "cv": 0.002099937574391164
    },
    {
      "group": 1,
      "id": "kernel.pthread_pingpong",
      "leg": "a",
      "config": "tuned",
      "unit": "ns_per_op",
      "n": 30,
      "warmupsDiscarded": 2,
      "samples": [
        3735.178,
        3663.461,
        3524.869,
        3544.107,
        3603.396,
        3607.974,
        3622.438,
        3431.552,
        3538.773,
        3512.578,
        3574.226,
        3626.691,
        3671.722,
        3400.488,
        3527.696,
        3826.027,
        3571.482,
        3613.216,
        3492.178,
        3479.711,
        3637.761,
        3630.045,
        3611.431,
        3527.132,
        3441.888,
        3529.834,
        3620.372,
        3653.254,
        3650.464,
        3444.1
      ],
      "median": 3588.811,
      "p95": 3735.178,
      "p99": 3826.027,
      "cv": 0.026123950489225053
    }
  ],
  "skipped": [],
  "notes": ""
}
